{
  "$schema": "https://json-schema.org/draft/2020-12/schema",
  "$id": "https://example.invalid/schemas/railway-benchmark-metric-report-v1.json",
  "type": "object",
  "required": ["schema_version", "report_id", "experiment_id", "evaluator_version", "generated_at", "metrics", "sample_counts", "limitations"],
  "properties": {
    "schema_version": {"const": "railway.benchmark.metric-report.v1"},
    "report_id": {"type": "string", "minLength": 3},
    "experiment_id": {"type": "string", "minLength": 3},
    "evaluator_version": {"type": "string", "minLength": 1},
    "generated_at": {"type": "string"},
    "metrics": {"type": "object"},
    "sample_counts": {"type": "object"},
    "limitations": {"type": "array", "items": {"type": "string"}}
  },
  "additionalProperties": true
}
